{
  "target": "サンプル端末 仕様（架空）target-sample/device-spec.md",
  "by": "Claude（AI の仮判定）",
  "date": "2026-10-23",
  "base": "..",
  "judgments": {
    "1A": {"check": "true", "reason": "メモの本文から電話番号などを見つけ、選んだ動作を実行する。",
      "evidence": [{"file": "target-sample/device-spec.md", "quote": "メモの本文から、電話番号・メールアドレス・日付を、正規表現の一覧で見つける。"},
                   {"file": "target-sample/device-spec.md", "quote": "一覧から選んだ動作を、その文字列に対して実行する。"}]},
    "1B": {"check": "true", "reason": "画面キーボードで文字を入力する。",
      "evidence": [{"file": "target-sample/device-spec.md", "quote": "文字はタッチ画面の上の画面キーボードで入力する。"}]},
    "1C": {"check": "true", "reason": "タッチ画面に表示する。",
      "evidence": [{"file": "target-sample/device-spec.md", "quote": "端末は、タッチ画面、メモリ、プロセッサを 1 つずつ持つ。"}]},
    "1D": {"check": "true", "reason": "メモリにアプリ（プログラム）を持つ。",
      "evidence": [{"file": "target-sample/device-spec.md", "quote": "端末は、タッチ画面、メモリ、プロセッサを 1 つずつ持つ。"}]},
    "1D.1.1": {"check": "false", "reason": "決め手。見つける処理はメモ帳アプリの中の関数で、別のプログラムに分けていない。米国の訴訟（Apple v. Motorola、連邦巡回控訴裁判所、2014 年）で「analyzer server」は「クライアントとは別のサーバーの処理」と読まれた（AI の記憶による。判決文は未確認）。",
      "evidence": [{"file": "target-sample/device-spec.md", "quote": "見つける処理はメモ帳アプリの中の関数で行い、別のプログラムやサーバーには分けない。"}]},
    "1D.1.1.1.1": {"check": "true", "reason": "正規表現の一覧で見つける。",
      "evidence": [{"file": "target-sample/device-spec.md", "quote": "電話番号・メールアドレス・日付を、正規表現の一覧で見つける。"}]},
    "1D.1.1.1.2": {"check": "true", "reason": "見つけた文字列の種類に動作の一覧を結び付ける。",
      "evidence": [{"file": "target-sample/device-spec.md", "quote": "その種類に合う動作の一覧（電話をかける・連絡先に足す・予定に足す）をポップアップで出す。"}]},
    "1D.1.2": {"check": "true", "reason": "下線の文字列を押し、動作を選べる。",
      "evidence": [{"file": "target-sample/device-spec.md", "quote": "下線の文字列を押すと、その種類に合う動作の一覧"}]},
    "1D.1.3": {"check": "true", "reason": "選んだ動作を実行する。",
      "evidence": [{"file": "target-sample/device-spec.md", "quote": "一覧から選んだ動作を、その文字列に対して実行する。"}]},
    "1E": {"check": "true", "reason": "プロセッサを持つ。",
      "evidence": [{"file": "target-sample/device-spec.md", "quote": "端末は、タッチ画面、メモリ、プロセッサを 1 つずつ持つ。"}]},
    "13A": {"check": "true", "reason": "メモ帳アプリ（プログラム）をメモリに持つ。",
      "evidence": [{"file": "target-sample/device-spec.md", "quote": "端末は、タッチ画面、メモリ、プロセッサを 1 つずつ持つ。"}]},
    "13B": {"check": "true", "reason": "メモの本文を受け取る。",
      "evidence": [{"file": "target-sample/device-spec.md", "quote": "文字はタッチ画面の上の画面キーボードで入力する。"}]},
    "13C": {"check": "true", "reason": "本文から電話番号などを見つける。",
      "evidence": [{"file": "target-sample/device-spec.md", "quote": "電話番号・メールアドレス・日付を、正規表現の一覧で見つける。"}]},
    "13D": {"check": "true", "reason": "種類に合う動作を結び付ける。",
      "evidence": [{"file": "target-sample/device-spec.md", "quote": "その種類に合う動作の一覧（電話をかける・連絡先に足す・予定に足す）をポップアップで出す。"}]},
    "13E": {"check": "true", "reason": "文字列を押して動作を選べる。",
      "evidence": [{"file": "target-sample/device-spec.md", "quote": "下線の文字列を押すと、その種類に合う動作の一覧"}]},
    "13F": {"check": "true", "reason": "選んだ動作を実行する。",
      "evidence": [{"file": "target-sample/device-spec.md", "quote": "一覧から選んだ動作を、その文字列に対して実行する。"}]},
    "14B": {"check": "tbd", "reason": "「means for ...」は、明細書に書かれた構造とその均等物に限って読む（米国特許法 112 条 (f)）。明細書の構造と照らす必要があり、仕様だけでは決められない。",
      "evidence": []},
    "15A": {"check": "true", "reason": "動作の一覧を持つ。",
      "evidence": [{"file": "target-sample/device-spec.md", "quote": "その種類に合う動作の一覧（電話をかける・連絡先に足す・予定に足す）をポップアップで出す。"}]},
    "15B": {"check": "true", "reason": "メモの本文を受け取る。",
      "evidence": [{"file": "target-sample/device-spec.md", "quote": "文字はタッチ画面の上の画面キーボードで入力する。"}]},
    "15C": {"check": "true", "reason": "本文から電話番号などを見つける。",
      "evidence": [{"file": "target-sample/device-spec.md", "quote": "電話番号・メールアドレス・日付を、正規表現の一覧で見つける。"}]},
    "15D": {"check": "true", "reason": "種類に合う動作を結び付ける。",
      "evidence": [{"file": "target-sample/device-spec.md", "quote": "その種類に合う動作の一覧（電話をかける・連絡先に足す・予定に足す）をポップアップで出す。"}]},
    "15E": {"check": "true", "reason": "文字列を押して動作を選べる。",
      "evidence": [{"file": "target-sample/device-spec.md", "quote": "下線の文字列を押すと、その種類に合う動作の一覧"}]},
    "15F": {"check": "true", "reason": "選んだ動作を実行する。",
      "evidence": [{"file": "target-sample/device-spec.md", "quote": "一覧から選んだ動作を、その文字列に対して実行する。"}]},
    "16B": {"check": "tbd", "reason": "本文はメモ帳アプリ自身のもので、別に動いているアプリから受け取るとは書いていない。「the application」の指す先も解釈しだい。",
      "evidence": [{"file": "target-sample/device-spec.md", "quote": "見つける処理はメモ帳アプリの中の関数で行い、別のプログラムやサーバーには分けない。"}]},
    "17B": {"check": "tbd", "reason": "正規表現の一覧が「grammars」に当たるかは解釈しだい。",
      "evidence": [{"file": "target-sample/device-spec.md", "quote": "正規表現の一覧で見つける。"}]},
    "20B": {"check": "true", "reason": "見つけた文字列に下線を引く（強調表示）。",
      "evidence": [{"file": "target-sample/device-spec.md", "quote": "見つけた文字列に下線を引く。"}]},
    "21B": {"check": "true", "reason": "動作の一覧をポップアップで出し、選ばせる。",
      "evidence": [{"file": "target-sample/device-spec.md", "quote": "その種類に合う動作の一覧（電話をかける・連絡先に足す・予定に足す）をポップアップで出す。"}]},
    "22E": {"check": "false", "reason": "決め手。メモ帳アプリが自分の中で見つけて表示するので、別に動いているアプリと通信しない。",
      "evidence": [{"file": "target-sample/device-spec.md", "quote": "見つける処理はメモ帳アプリの中の関数で行い、別のプログラムやサーバーには分けない。"}]},
    "23B": {"check": "false", "reason": "決め手。音声では操作しない。",
      "evidence": [{"file": "target-sample/device-spec.md", "quote": "音声では操作しない。"}]},
    "24B": {"check": "tbd", "reason": "動作が別の動作を呼ぶかは仕様に記述なし（記述が無いことは「無い」ことではない）。",
      "evidence": []}
  }
}
