{
  "target": "サンプル端末 仕様（架空）target-sample/device-spec.md",
  "by": "Claude（AI の仮判定）",
  "date": "2026-10-23",
  "base": "..",
  "judgments": {
    "1A": {"check": "true", "reason": "タッチ画面を持つ端末のロックを外す方法である。",
      "evidence": [{"file": "target-sample/device-spec.md", "quote": "端末は、タッチ画面、メモリ、プロセッサを 1 つずつ持つ。"}]},
    "1B": {"check": "false", "reason": "決め手。ロック画面に鍵の絵（unlock image）を出さないので、その絵の位置で触れたことを検出しない。",
      "evidence": [{"file": "target-sample/device-spec.md", "quote": "鍵や矢印の絵は出さない。"}]},
    "1C.1": {"check": "false", "reason": "決め手。払うあいだ、画面の絵を動かさない。",
      "evidence": [{"file": "target-sample/device-spec.md", "quote": "払うあいだ、画面の絵は動かさない。"}]},
    "1D": {"check": "false", "reason": "絵を決めた所まで動かすのではなく、払った長さでロックを外す。",
      "evidence": [{"file": "target-sample/device-spec.md", "quote": "画面の下端から上へ、指 1 本で画面の高さの 30% 以上払ったら、ロックを外す。"}]},
    "7A": {"check": "true", "reason": "持ち運べる端末である。",
      "evidence": [{"file": "target-sample/device-spec.md", "quote": "端末は、タッチ画面、メモリ、プロセッサを 1 つずつ持つ。"}]},
    "7B": {"check": "true", "reason": "タッチ画面を持つ。",
      "evidence": [{"file": "target-sample/device-spec.md", "quote": "端末は、タッチ画面、メモリ、プロセッサを 1 つずつ持つ。"}]},
    "7C": {"check": "true", "reason": "メモリを持つ。",
      "evidence": [{"file": "target-sample/device-spec.md", "quote": "端末は、タッチ画面、メモリ、プロセッサを 1 つずつ持つ。"}]},
    "7D": {"check": "true", "reason": "プロセッサを持つ。",
      "evidence": [{"file": "target-sample/device-spec.md", "quote": "端末は、タッチ画面、メモリ、プロセッサを 1 つずつ持つ。"}]},
    "7E.1.1": {"check": "false", "reason": "決め手。鍵の絵を出さない。",
      "evidence": [{"file": "target-sample/device-spec.md", "quote": "鍵や矢印の絵は出さない。"}]},
    "7E.1.2.1": {"check": "false", "reason": "決め手。払うあいだ、画面の絵を動かさない。",
      "evidence": [{"file": "target-sample/device-spec.md", "quote": "払うあいだ、画面の絵は動かさない。"}]},
    "11C": {"check": "false", "reason": "決め手。鍵の絵を出さない。",
      "evidence": [{"file": "target-sample/device-spec.md", "quote": "鍵や矢印の絵は出さない。"}]},
    "11E.1": {"check": "false", "reason": "決め手。払うあいだ、画面の絵を動かさない。",
      "evidence": [{"file": "target-sample/device-spec.md", "quote": "払うあいだ、画面の絵は動かさない。"}]},
    "12B": {"check": "false", "reason": "決め手。鍵の絵を出さない。",
      "evidence": [{"file": "target-sample/device-spec.md", "quote": "鍵や矢印の絵は出さない。"}]},
    "12C.1": {"check": "false", "reason": "決め手。払うあいだ、画面の絵を動かさない。",
      "evidence": [{"file": "target-sample/device-spec.md", "quote": "払うあいだ、画面の絵は動かさない。"}]}
  }
}
